<?xml version="1.0" encoding="utf-8"?>
<!DOCTYPE cinema SYSTEM "Cinema.dtd">
<cinema>
    <cinemaName>Кино Арена - Плевен</cinemaName>
    <contacts>
        <country>България</country>
        <city>Плевен</city>
        <street>пл. Иван Миндиликов 1</street>
        <email>kino_pleven@kinoarena.bg</email>
        <phone>02 4047 129</phone>
    </contacts>
    <staff>
        <employee id="1" job="Администратор" gender="Жена">
            <employeeName>Анастасия Събилянова</employeeName>
            <employeeEmail>AnastasiqKazimirova@abv.bg</employeeEmail>
            <employeePhone>0887 282 986</employeePhone>
            <salary currency="BGN">1250</salary>
        </employee>
        <employee id="2" job="Разпоредител" gender="Жена">
            <employeeName>Розанка Славолюбова</employeeName>
            <employeeEmail>Rozanka_Dobrqnova@gmail.bg</employeeEmail>
            <employeePhone>0889 771 625</employeePhone>
            <salary currency="BGN">1050</salary>
        </employee>
        <employee id="3" job="Касиер" gender="Жена">
            <employeeName>Дамяна Николчева</employeeName>
            <employeeEmail>DamqnaKazimirova@yahoo.bg</employeeEmail>
            <employeePhone>0888 096 646</employeePhone>
            <salary currency="BGN">850</salary>
        </employee>
        <employee id="4" job="КафеСлужител" gender="Жена">
            <employeeName>Хриса Кирякева Раянова</employeeName>
            <employeeEmail>HrisaKirqkeva@abv.bg</employeeEmail>
            <employeePhone>0889 478 964</employeePhone>
            <salary currency="BGN">850</salary>
        </employee>
    </staff>
    <movies>
        <movie genre="Анимация" category="2Д">
            <movieName>Горските мечоци: Див Свят</movieName>
            <actors>
                Крис Бойки, Ники Стинсон, Тан Хао, Занг Уеи, Бингжун Занг
            </actors>
            <movieDescription>
                Вълнуващ нов увеселителен парк отваря врати в Пайн Трий.
                „Див Свят“ предлага невиждана досега атракция!
                С помощта на революционно откритие в генетиката всеки може да се превърне в диво животно!
                И да изживее емоцията на дивия свят по неповторим начин.
                Освен това всеки може да участва в състезание с награда от един милион долара!
                Вик и любимите ни Горски мечоци решават да се включат в състезанието като отбор заедно с Брембъл,
                Реймънд и мистериозния Леон. И изненадващо дори за самите тях те печелят!
                Но с това започват и истинските изпитания!
                Защото Леон има тайна мисия, Брембъл преследва свои цели, а собственикът на „Див Свят“
                Том не само е направил откритие в генетиката, но и е нарушил всички закони и морални норми.
            </movieDescription>
            <duration>99 минути</duration>
            <projections>11:00, 12:00, 13:15, 15:30</projections>
            <hall>2</hall>
            <ticket currency="BGN">7</ticket>
        </movie>
        <movie genre="Анимация" category="2Д">
            <movieName>Клифърд: Голямото червено куче</movieName>
            <actors>
                Дарби Камп, Сиена Гилори, Джак Уайтхол, Джон Клийз
            </actors>
            <movieDescription>
                Докато Емили се мъчи да се впише у дома и в училище, тя открива малко червено кученце,
                което е предопределено да стане най -добрият й приятел. Само че кучето е необикновено....
            </movieDescription>
            <duration>97 минути</duration>
            <projections>14:15</projections>
            <hall>1</hall>
            <ticket currency="BGN">7</ticket>
        </movie>
        <movie genre="Анимация" category="2Д">
            <movieName>Ела, изпей 2</movieName>
            <actors>
                Тарон Егертън, Матю Макконъхи, Скарлет Йохансон
            </actors>
            <movieDescription>
                Продължение на световния попкултурен феномен на Illumination, Ела, изпей! 2 отново ни среща с предприемчивата,
                оптимистично настроена коала Бъстър Муун и неговия звезден състав от колоритни музикални изпълнители,
                които ще стартират най-ослепителната си феерия до момента. Има само една уловка: първо трябва да
                убедят най-известната рокзвезда на света, отказала се от сцената и живееща в пълно усамотение,
                да се присъедини към тях.
            </movieDescription>
            <duration>108 минути</duration>
            <projections>12:30</projections>
            <hall>3</hall>
            <ticket currency="BGN">7</ticket>
        </movie>
        <movie genre="Фантастика" category="3Д">
            <movieName>Спайдърмен: Няма път към дома</movieName>
            <actors>
                Зендая, Том Холанд, Бенедикт Къмбърбач, Мариса Томей, Джейми Фокс, Ангури Райс
            </actors>
            <movieDescription>
                Питър Паркър е свалил маската и вече не може да раздели нормалния си живот от този на супергерой.
                Когато моли за помощ Доктор Стрейндж, залогът става още по-опасен.
                Питър ще разбере какво наистина означава да си Спайдърмен.
            </movieDescription>
            <duration>150 минути</duration>
            <projections>15:00</projections>
            <hall>Vip</hall>
            <ticket currency="BGN">10</ticket>
        </movie>
    </movies>
    <food>
        <offer type="Храна">
            <productName>Пуканки</productName>
            <quantity>Средни</quantity>
            <price currency="BGN">4.99</price>
        </offer>
        <offer type="Храна">
            <productName>Пуканки</productName>
            <quantity>Големи</quantity>
            <price currency="BGN">5.99</price>
        </offer>
        <offer type="Напитка">
            <productName>Кола</productName>
            <quantity>500мл.</quantity>
            <price currency="BGN">5.99</price>
        </offer>
        <offer type="Напитка">
            <productName>Кола</productName>
            <quantity>750мл.</quantity>
            <price currency="BGN">6.99</price>
        </offer>
    </food>
</cinema>