<?xml version="1.0" encoding="utf-8"?>
<!DOCTYPE cinema SYSTEM "Cinema.dtd">
<cinema>
    <cinemaName>Кино Арена - Бургас</cinemaName>
    <contacts>
        <country>България</country>
        <city>Бургас</city>
        <street>бул. България 69</street>
        <email>kino_burgas@kinoarena.bg</email>
        <phone>02 4047 123</phone>
    </contacts>
    <staff>
        <employee id="1" job="Администратор" gender="Жена">
            <employeeName>Росица Танова</employeeName>
            <employeeEmail>RosicaVuleva@abv.bg</employeeEmail>
            <employeePhone>0888 001 802</employeePhone>
            <salary currency="BGN">1500</salary>
        </employee>
        <employee id="2" job="Разпоредител" gender="Жена">
            <employeeName>Ивет Тимонова</employeeName>
            <employeeEmail>IvetGodislavova@gmail.bg</employeeEmail>
            <employeePhone>0889 921 940</employeePhone>
            <salary currency="BGN">1200</salary>
        </employee>
        <employee id="3" job="Касиер" gender="Мъж">
            <employeeName>Тихослав Светланов</employeeName>
            <employeeEmail>Tihoslav_Karlov@yahoo.bg</employeeEmail>
            <employeePhone>0889 810 501</employeePhone>
            <salary currency="BGN">950</salary>
        </employee>
        <employee id="4" job="КафеСлужител" gender="Мъж">
            <employeeName>Николай Филиев</employeeName>
            <employeeEmail>Nikolaj_Teodorov@abv.bg</employeeEmail>
            <employeePhone>0888 107 896</employeePhone>
            <salary currency="BGN">950</salary>
        </employee>
    </staff>
    <movies>
        <movie genre="Драма" category="2Д">
            <movieName>Петя на моята Петя</movieName>
            <actors>
                Александра Костова, Алиса Атанасова, Албена Павлова, Юлиан Вергов, Моньо Монев,
                Алена Вергова, Ясен Атанасов, Мартин Методиев, Емил Марков, Александър Милчев
            </actors>
            <movieDescription>
                Коя е Петя?
                Новата учебна година започва с внезапни промени. Нов директор, нови правила и тежък инцидент,
                който ще промени живота на група младежи от 11ти клас. На фона на несправедливостта в гимназията,
                едно момиче решава да действа и да се бори срещу всичко, което превръща съучениците ѝ „в консервни кутии без етикети“.
                Защото системата в лицето на директор Крачунов обича послушните и не толерира различните.
                40 години след смъртта на любимата ѝ поетеса Петя Дубарова, Петя ще открие смисъла в това да живее и обича истински.
            </movieDescription>
            <duration>95 минути</duration>
            <projections>11:00, 13:25, 16:00, 18:00, 20:00, 22:00</projections>
            <hall>2</hall>
            <ticket currency="BGN">10</ticket>
        </movie>
        <movie genre="Ужаси" category="2Д">
            <movieName>Писък</movieName>
            <actors>
                Нев Кембъл, Кортни Кокс, Дейвид Аркет, Джак Куейд, Марли Шелтън, Мелиса Барера, Джена Ортега, Дилън Минет
            </actors>
            <movieDescription>
                25 години след като поредица от брутални убийства шокира жителите на малкото и спокойно градче Уудсбъро,
                нов убиец надява емблематичната маска на Гоустфейс и започва да избива група тийнейджъри,
                възкресявайки тайни от смъртоносното минало на града. Ветераните от няколко сблъсъка с
                различни проявления на безмилостния Гоустфейс Сидни Прескот, Гейл Уедърс и Дюи Райли се
                събират отново в опит да разкрият мистерията и да спасят младежите и себе си преди да е
                станало твърде късно. Този път обаче има нещо различно – правилата на играта за оцеляване са вече други...
            </movieDescription>
            <duration>116 минути</duration>
            <projections>18:30, 21:00</projections>
            <hall>1</hall>
            <ticket currency="BGN">7</ticket>
        </movie>
        <movie genre="Екшън" category="2Д">
            <movieName>The King's Man: Първа Мисия</movieName>
            <actors>
                Ралф Файнс, Джема Артъртън, Рис Ифанс, Харис Дикинсън, Джимон Унсу, Матю Гууд, Том Холандър, Даниел Брюл, Чарлс Данс
            </actors>
            <movieDescription>
                King's Man: Първа мисия ни връща към корените на първата независима шпионска агенция,
                работеща на най-високо ниво на дискретност и чиято нестандартна дейност е едновременно
                изискана и брутална, цивилизована и безмилостна. Когато най-безскрупулните злодеи и
                престъпни гении в историята, сред които Распутин, Мата Хари, Ерик Ян Ханусен и Вилхелм II,
                се събират, за да планират война, която да избие милиони хора, съдбата на света пада върху
                плещите на млад джентълмен, който влиза в надпревара с времето, за да предотврати драматичния
                изход от събитията.
            </movieDescription>
            <duration>131 минути</duration>
            <projections>13:00, 20:00, 21:15</projections>
            <hall>3</hall>
            <ticket currency="BGN">9</ticket>
        </movie>
        <movie genre="Криминален" category="2Д">
            <movieName>Домът на Gucci</movieName>
            <actors>
                Адам Драйвър, Лейди Гага, Джереми Айрънс, Ал Пачино, Джаред Лето
            </actors>
            <movieDescription>
                Вдъхновен от шокиращата истинска история на империята зад италианската модна къща Gucci,
                филмът ще разкрие на зрителите какво означава да носиш това име, каква е неговата цена и
                колко далеч би стигнало едно семейство, за да получи контрол и власт. Ще станем свидетели
                на три десетилетия, изпълнени с любов, упадък, амбиция, предателства и отмъщение,
                водещи до трагичен край – убийство.
            </movieDescription>
            <duration>158 минути</duration>
            <projections>19:45</projections>
            <hall>4</hall>
            <ticket currency="BGN">11</ticket>
        </movie>
    </movies>
    <food>
        <offer type="Храна">
            <productName>Пуканки</productName>
            <quantity>Средни</quantity>
            <price currency="BGN">4.99</price>
        </offer>
        <offer type="Храна">
            <productName>Пуканки</productName>
            <quantity>Големи</quantity>
            <price currency="BGN">5.99</price>
        </offer>
        <offer type="Напитка">
            <productName>Фанта</productName>
            <quantity>500мл.</quantity>
            <price currency="BGN">6.99</price>
        </offer>
        <offer type="Напитка">
            <productName>Фанта</productName>
            <quantity>750мл.</quantity>
            <price currency="BGN">7.99</price>
        </offer>
    </food>
</cinema>